name,knownFor,intro,longBio,achievement,birthYear,deathYear,birthCity,birthCountry,nationality,century,contributionYear,era,classification,gender,education,awards,institutions,notableWorks,influencedBy,influenced,funFacts,latitude,longitude,imageLocal
Robin Milner,"Arthur John Robin Gorell Milner was a British computer scientist, and he won the 1991","Robin Milner (1934-2010) was a British computer scientist known for his work in the field of theoretical computer science, particularly in the area of programming languages and formal methods. He developed the Calculus of Communicating Systems (CCS) and the programming language ML. Milner's contributions have advanced the field of formal methods and programming language design.","Arthur John Robin Gorell Milner was a British computer scientist, and he won the 1991 ACM Turing Award.","LCF, the mechanization of Scott's Logic of Computable Functions, probably the first theoretically based yet practical tool for machine assisted proof construction;  ML, the first language to include polymorphic type inference together with a type-safe exception-handling mechanism;  CCS, a general theory of concurrency. In addition, he formulated and strongly advanced full abstraction, the study of the relationship between operational and denotational semantics.",1934,2010,Plymouth,United Kingdom,United Kingdom,20,1991,Internet Age,"[""programming languages"", ""formal methods""]",male,"[{""degree"": null, ""field"": null, ""institution"": ""Eton College"", ""year"": null}, {""degree"": null, ""field"": null, ""institution"": ""King's College"", ""year"": null}]","[{""name"": ""Fellow of the British Computer Society"", ""year"": null}, {""name"": ""Friedrich L. Bauer Prize"", ""year"": 1994}, {""name"": ""EATCS award"", ""year"": 2005}, {""name"": ""honorary doctorate from University of Paris-XI"", ""year"": 2007}, {""name"": ""Programming Languages Achievement Award"", ""year"": 2001}, {""name"": ""ACM Fellow"", ""year"": 1994}, {""name"": ""Fellow of the Royal Society of Edinburgh"", ""year"": null}, {""name"": ""honorary doctorate of the University of Glasgow"", ""year"": null}, {""name"": ""Turing Award"", ""year"": 1991}, {""name"": ""honorary doctor of the University of Edinburgh"", ""year"": null}, {""name"": ""honorary doctor of the University of Stirling"", ""year"": null}]","[{""name"": ""City, University of London"", ""role"": null, ""years"": null}, {""name"": ""University of Edinburgh"", ""role"": null, ""years"": null}, {""name"": ""Swansea University"", ""role"": null, ""years"": null}, {""name"": ""Stanford University"", ""role"": null, ""years"": null}]",[],[],[],"[""Arthur John Robin Gorell Milner  (13 January 1934 – 20 March 2010) was a British computer scientist, and he won the 1991 ACM Turing Award.""]",50.3484,3.999,https://pioneersincs.blob.core.windows.net/pioneers-images/robin_milner.webp
Linus Torvalds,Linus Benedict Torvalds is a Finnish and American software engineer who is the creator and,"Linus Torvalds (born 1969) is a Finnish-American software engineer and the creator of the Linux kernel, the core component of the Linux operating system. Torvalds' open-source approach and collaborative development model have made Linux one of the most widely used operating systems worldwide, powering a variety of devices and systems.",Linus Benedict Torvalds is a Finnish and American software engineer who is the creator and lead developer of the Linux kernel since 1991. He also created the distributed version control system Git.,Known as the creator of the Linux operating system and the Git version control system. His contributions have shaped the open-source software movement and have had a significant impact on the field of computer science.,1969,,Helsinki,Finland,Finland,20,1991,Internet Age,"[""operating systems""]",male,"[{""degree"": null, ""field"": null, ""institution"": ""Svenska normallyceum"", ""year"": null}, {""degree"": ""master's degree"", ""field"": null, ""institution"": ""University of Helsinki"", ""year"": 1996}]","[{""name"": ""Takeda Awards"", ""year"": 2001}, {""name"": ""Internet Hall of Fame"", ""year"": 2012}, {""name"": ""EFF Award"", ""year"": 1998}, {""name"": ""Nokia Foundation Recognition Award"", ""year"": null}, {""name"": ""honorary doctor of Stockholm University"", ""year"": 1999}, {""name"": ""Lovelace Medal"", ""year"": 2000}, {""name"": ""European of the Year"", ""year"": 2001}, {""name"": ""IEEE Masaru Ibuka Consumer Electronics Award"", ""year"": 2018}, {""name"": ""doctor honoris causa of the University of Helsinki"", ""year"": 2000}, {""name"": ""Computer History Museum Fellow"", ""year"": 2008}, {""name"": ""Millennium Technology Prize"", ""year"": 2012}, {""name"": ""Suuret suomalaiset"", ""year"": null}, {""name"": ""Computer Pioneer Award"", ""year"": 2014}]","[{""name"": ""Linux Foundation"", ""role"": null, ""years"": ""2007–""}, {""name"": ""University of Helsinki"", ""role"": null, ""years"": ""1992–1996""}, {""name"": ""Transmeta Corporation"", ""role"": null, ""years"": ""1997–2003""}, {""name"": ""Open Source Development Labs"", ""role"": null, ""years"": ""2003–2007""}]","[{""title"": ""Linux kernel"", ""type"": ""other"", ""year"": 1991}, {""title"": ""Subsurface"", ""type"": ""other"", ""year"": 2011}]",[],[],"[""He is also the recipient of the 2014 IEEE Computer Society Computer Pioneer Award and the 2018 IEEE Masaru Ibuka Consumer Electronics Award.""]",60.17,24.9386,https://pioneersincs.blob.core.windows.net/pioneers-images/linus_torvalds.webp
Raj Reddy,"Dabbala Rajagopal ""Raj"" Reddy is an Indian-born American computer scientist",Raj Reddy (born 1937) is an Indian-American computer scientist and recipient of the Turing Award. He has made significant contributions to the field of artificial intelligence and speech recognition. Reddy's work on voice recognition systems and language understanding has had a profound impact on the development of intelligent systems and human-computer interaction.,"Dabbala Rajagopal ""Raj"" Reddy is an Indian-born American computer scientist. He is one of the early pioneers of artificial intelligence and has served on the faculty of Stanford and Carnegie Mellon for over 50 years. He was the founding director of the Robotics Institute at Carnegie Mellon University. He was instrumental in helping to create Rajiv Gandhi University of Knowledge Technologies in India, to cater to the educational needs of the low-income, gifted, rural youth. He was the founding chairman of International Institute of Information Technology, Hyderabad. He and Edward Feigenbaum won the 1994 ACM Turing Award, sometimes known as the Nobel Prize of computer science, for their work in the field of artificial intelligence. Reddy was the first person of Asian origin to receive the Turing Award.","Pioneering the design and construction of large scale artificial intelligence systems, demonstrating the practical importance and potential commercial impact of artificial intelligence technology.",1937,,Katur,India,India,20,1994,Internet Age,"[""artificial intelligence"", ""human-computer interaction""]",male,"[{""degree"": ""Bachelor of Engineering"", ""field"": null, ""institution"": ""Guindy Engineering College"", ""year"": 1958}, {""degree"": ""Doctor of Philosophy"", ""field"": null, ""institution"": ""Stanford University"", ""year"": 1966}, {""degree"": ""master's degree"", ""field"": null, ""institution"": ""University of New South Wales"", ""year"": null}]","[{""name"": ""Padma Bhushan in science & engineering"", ""year"": 2001}, {""name"": ""Knight of the Legion of Honour"", ""year"": 1984}, {""name"": ""IEEE James L. Flanagan Speech and Audio Processing Award"", ""year"": null}, {""name"": ""Fellow of the Acoustical Society of America"", ""year"": 1979}, {""name"": ""honorary doctorate of the Henri Poincaré University"", ""year"": 1997}, {""name"": ""ACM Fellow"", ""year"": 2012}, {""name"": ""Guggenheim Fellowship"", ""year"": null}, {""name"": ""IEEE Fellow"", ""year"": null}, {""name"": ""Turing Award"", ""year"": 1994}, {""name"": ""Okawa Prize"", ""year"": 2004}, {""name"": ""AAAI Fellow"", ""year"": 1990}]","[{""name"": ""Carnegie Mellon University"", ""role"": null, ""years"": null}, {""name"": ""Stanford University"", ""role"": null, ""years"": null}]",[],[],[],"[""He and Edward Feigenbaum won the 1994 ACM Turing Award, sometimes known as the Nobel Prize of computer science, for their work in the field of artificial intelligence."", ""Reddy was the first person of Asian origin to receive the Turing Award.""]",13.217094,79.100677,https://pioneersincs.blob.core.windows.net/pioneers-images/raj_reddy.webp
Feng-hsiung Hsu,Feng-hsiung Hsu is a Taiwanese-American computer scientist and electrical engineer,"Feng-hsiung Hsu is a Taiwanese-American computer scientist known for his work in the field of artificial intelligence and specifically for developing the Deep Blue chess-playing computer. Deep Blue defeated the reigning world chess champion Garry Kasparov in 1997, marking a significant milestone in the development of AI and game-playing systems.","Feng-hsiung Hsu is a Taiwanese-American computer scientist and electrical engineer. His work led to the creation of the Deep Thought chess computer, which led to the first chess playing computer to defeat grandmasters in tournament play and the first to achieve a certified grandmaster-level rating.","Work leading to the creation of the Deep Thought chess computer; architect and principal designer IBM Deep Blue chess computer that defeated the reigning World Chess Champion, Garry Kasparov, in 1997",1959,,Keelung,Taiwan,Taiwan,20,1997,Internet Age,"[""artificial intelligence""]",male,"[{""degree"": null, ""field"": null, ""institution"": ""Carnegie Mellon University"", ""year"": null}, {""degree"": null, ""field"": null, ""institution"": ""National Taiwan University"", ""year"": null}]","[{""name"": ""Grace Murray Hopper Award"", ""year"": 1991}]",[],[],[],[],"[""His work led to the creation of the Deep Thought chess computer, which led to the first chess playing computer to defeat grandmasters in tournament play and the first to achieve a certified grandmaster-level rating.""]",23.6973,120.9608,https://pioneersincs.blob.core.windows.net/pioneers-images/feng_hsiung_hsu.webp
Judea Pearl,"Judea Pearl is an Israeli-American electrical engineer, computer scientist and philosopher, best known for championing","Judea Pearl (born 1936) is an Israeli-American computer scientist and recipient of the Turing Award. He has made significant contributions to the field of artificial intelligence, particularly in the area of probabilistic reasoning and causal inference. Pearl's work on Bayesian networks and causal models has advanced the understanding of complex systems and decision-making processes.","Judea Pearl is an Israeli-American electrical engineer, computer scientist and philosopher, best known for championing the probabilistic approach to artificial intelligence and the development of Bayesian networks. He is also credited for developing a theory of causal and counterfactual inference based on structural models. In 2011, the Association for Computing Machinery (ACM) awarded Pearl with the Turing Award, the highest distinction in computer science, ""for fundamental contributions to artificial intelligence through the development of a calculus for probabilistic and causal reasoning"". He is the author of several books, including the technical Causality: Models, Reasoning and Inference, and The Book of Why, a book on causality aimed at the general public.",Fundamental contributions to artificial intelligence through the development of a calculus for probabilistic and causal reasoning.[,1936,,Tel Aviv,Israel,United States,21,2011,AI Era,"[""artificial intelligence""]",male,"[{""degree"": ""Doctor of Philosophy"", ""field"": null, ""institution"": ""New York University Tandon School of Engineering"", ""year"": 1965}, {""degree"": null, ""field"": null, ""institution"": ""University of California, Los Angeles"", ""year"": null}, {""degree"": null, ""field"": null, ""institution"": ""New York University Tandon School of Engineering"", ""year"": null}, {""degree"": ""Master of Science"", ""field"": null, ""institution"": ""Rutgers University"", ""year"": 1965}, {""degree"": ""Bachelor of Science"", ""field"": null, ""institution"": ""Technion – Israel Institute of Technology"", ""year"": 1960}]","[{""name"": ""Rumelhart Prize"", ""year"": 2011}, {""name"": ""IJCAI Award for Research Excellence"", ""year"": 1999}, {""name"": ""Kampé de Fériet Award"", ""year"": 2024}, {""name"": ""Fellow of the American Statistical Association"", ""year"": 2019}, {""name"": ""Foreign Member of the Royal Society"", ""year"": 2025}, {""name"": ""Harvey Prize"", ""year"": 2012}, {""name"": ""Lakatos Award"", ""year"": 2001}, {""name"": ""Fellow of the American Academy of Arts and Sciences"", ""year"": null}, {""name"": ""ACM-AAAI Allen Newell Award"", ""year"": 2003}, {""name"": ""Honorary doctorate from University of Toronto"", ""year"": null}, {""name"": ""ACM Fellow"", ""year"": 2015}, {""name"": ""Dickson Prize in Science"", ""year"": 2016}, {""name"": ""Turing Award"", ""year"": 2011}, {""name"": ""AAAI Fellow"", ""year"": 1990}, {""name"": ""IEEE Fellow"", ""year"": null}, {""name"": ""Fellow of the Cognitive Science Society"", ""year"": null}, {""name"": ""Benjamin Franklin Medal"", ""year"": 2008}]","[{""name"": ""University of California, Los Angeles"", ""role"": null, ""years"": ""1970–""}]","[{""title"": ""The Book of Why"", ""type"": ""other"", ""year"": 2019}, {""title"": ""Bayesian network"", ""type"": ""other"", ""year"": null}, {""title"": ""causal diagram"", ""type"": ""other"", ""year"": null}]",[],"[""Eliezer Yudkowsky""]","[""He is the author of several books, including the technical Causality: Models, Reasoning and Inference, and The Book of Why, a book on causality aimed at the general public."", ""Judea Pearl is the father of journalist Daniel Pearl, who was kidnapped and murdered by terrorists in Pakistan connected with Al-Qaeda and the International Islamic Front in 2002.""]",32.0853,34.7813,https://pioneersincs.blob.core.windows.net/pioneers-images/judea_pearl.webp
Yoshua Bengio,"Yoshua Bengio is a Canadian computer scientist, and a pioneer of artificial neural networks and","Yoshua Bengio (born 1964) is a Canadian computer scientist and one of the pioneers in the field of deep learning. His research focuses on artificial intelligence, neural networks, and machine learning. Bengio has made significant contributions to the development of deep learning algorithms and has played a key role in advancing the field of AI.","Yoshua Bengio is a Canadian computer scientist, and a pioneer of artificial neural networks and deep learning. He is a professor at the Université de Montréal and co-president and scientific director of the nonprofit LawZero. He founded Mila, the Quebec Artificial Intelligence (AI) Institute, and was its scientific director until 2025.",Conceptual and engineering breakthroughs that have made deep neural networks a critical component of computing,1964,,Paris,France,France,21,2018,AI Era,"[""artificial intelligence""]",male,"[{""degree"": ""Doctor of Philosophy"", ""field"": null, ""institution"": ""McGill University"", ""year"": 1991}, {""degree"": ""Master of Science"", ""field"": null, ""institution"": ""McGill University"", ""year"": 1988}, {""degree"": ""Bachelor of Science"", ""field"": null, ""institution"": ""McGill University"", ""year"": null}, {""degree"": null, ""field"": null, ""institution"": ""Massachusetts Institute of Technology"", ""year"": null}]","[{""name"": ""AAAI Fellow"", ""year"": 2020}, {""name"": ""Knight of the Legion of Honour"", ""year"": 2022}, {""name"": ""Princess of Asturias Award for Technical and Scientific Research"", ""year"": 2022}, {""name"": ""ACM Fellow"", ""year"": 2023}, {""name"": ""Prix Marie-Victorin"", ""year"": 2017}, {""name"": ""Fellow of the Royal Society of Canada"", ""year"": 2017}, {""name"": ""Officer of the National Order of Quebec"", ""year"": null}, {""name"": ""Queen Elizabeth Prize for Engineering"", ""year"": 2025}, {""name"": ""Fellow of the Royal Society"", ""year"": 2020}, {""name"": ""IEEE Neural Networks Pioneer Award"", ""year"": 2019}, {""name"": ""VinFuture Prize"", ""year"": 2024}, {""name"": ""Officer of the Order of Canada"", ""year"": 2017}, {""name"": ""Turing Award"", ""year"": 2018}, {""name"": ""Acfas Urgel-Archambeault Award"", ""year"": 2009}]","[{""name"": ""Université de Montréal"", ""role"": null, ""years"": ""1993–""}]",[],[],"[""Bonaventure F. P. Dossou""]","[""Yoshua Bengio  (born March 5, 1964) is a Canadian computer scientist, and a pioneer of artificial neural networks and deep learning."", ""In November 2025, Bengio became the first AI researcher with more than a million Google Scholar citations.""]",48.8569,2.3529,https://pioneersincs.blob.core.windows.net/pioneers-images/yoshua_bengio.webp
Pat Hanrahan,Patrick M,"Pat Hanrahan is an American computer graphics researcher and co-founder of Tableau Software. He received the Turing Award for his contributions to computer graphics, including the development of the RenderMan rendering system. Hanrahan's work has had a profound impact on the field, enabling realistic computer-generated images and advancing the visualization of complex data.","Patrick M. Hanrahan is an American computer graphics researcher, the Canon USA Professor of Computer Science and Electrical Engineering in the Computer Graphics Laboratory at Stanford University.
His research focuses on rendering algorithms, graphics processing units, as well as scientific illustration and visualization. He has received numerous awards, including the 2019 Turing Award.","Fundamental contributions to 3D computer graphics, with revolutionary impact on computer-generated imagery (CGI) in filmmaking and other applications",1955,,Milwaukee,U.S.A,United States,21,2019,AI Era,"[""computer graphics""]",male,"[{""degree"": null, ""field"": null, ""institution"": ""University of Wisconsin–Madison"", ""year"": null}]","[{""name"": ""ACM Fellow"", ""year"": 2008}, {""name"": ""Fellow of the American Academy of Arts and Sciences"", ""year"": 2007}, {""name"": ""Turing Award"", ""year"": 2019}]","[{""name"": ""Stanford University"", ""role"": null, ""years"": null}]",[],[],[],"[""He has received numerous awards, including the 2019 Turing Award.""]",44.5133,-88.0137,https://pioneersincs.blob.core.windows.net/pioneers-images/pat_hanrahan.webp
Fred Brooks,Frederick Phillips Brooks Jr,"Frederick P. Brooks Jr. (born 1931) is an American computer scientist and software engineer. He is best known for managing the development of IBM's System/360 mainframe computer and for writing the influential book ""The Mythical Man-Month."" Brooks' work has greatly influenced the field of software engineering and project management. He received the Turing Award in 1999.","Frederick Phillips Brooks Jr. was an American computer architect, software engineer, and computer scientist, best known for managing development of IBM's System/360 family of mainframe computers and the OS/360 software support package, then later writing candidly about those experiences in his seminal book The Mythical Man-Month.","Known for his seminal book ""The Mythical Man-Month"" which addresses the challenges of managing large-scale software projects. Brooks also played a key role in the development of IBM's System/360 mainframe computer series. His insights on software engineering, project management, and computer architecture have had a profound and lasting impact on the field of computer science.",1931,2022,Durham,U.S.A,United States,20,1959,Cold War Computing,"[""human-computer interaction"", ""software engineering""]",male,"[{""degree"": null, ""field"": null, ""institution"": ""Duke University"", ""year"": null}, {""degree"": null, ""field"": null, ""institution"": ""Harvard School of Engineering and Applied Sciences"", ""year"": null}, {""degree"": null, ""field"": null, ""institution"": ""Harvard University"", ""year"": null}]","[{""name"": ""ACM Fellow"", ""year"": 1994}, {""name"": ""ACM-AAAI Allen Newell Award"", ""year"": 1994}, {""name"": ""Turing Award"", ""year"": 1999}, {""name"": ""Guggenheim Fellowship"", ""year"": 1974}, {""name"": ""Harry H. Goode Memorial Award"", ""year"": 1989}, {""name"": ""ACM Distinguished Service Award"", ""year"": 1987}, {""name"": ""National Medal of Technology and Innovation"", ""year"": 1985}, {""name"": ""IEEE John von Neumann Medal"", ""year"": 1993}, {""name"": ""Harvard Centennial Medal"", ""year"": null}, {""name"": ""Eckert–Mauchly Award"", ""year"": 2004}, {""name"": ""Bower Award and Prize for Achievement in Science"", ""year"": 1996}, {""name"": ""Computer History Museum Fellow"", ""year"": null}, {""name"": ""Fellow of the British Computer Society"", ""year"": null}, {""name"": ""honorary doctor of ETH Zürich"", ""year"": 1991}, {""name"": ""Turing Talk"", ""year"": 2005}, {""name"": ""W. Wallace McDowell Award"", ""year"": 1970}]","[{""name"": ""University of North Carolina at Chapel Hill"", ""role"": null, ""years"": ""1965–""}, {""name"": ""IBM"", ""role"": null, ""years"": ""1956–1965""}]","[{""title"": ""OS/360"", ""type"": ""other"", ""year"": 1966}]",[],[],"[""Brooks received many awards, including the National Medal of Technology in 1985 and the 1999 ACM Turing Award.""]",35.994,-78.8982,https://pioneersincs.blob.core.windows.net/pioneers-images/fred_brooks.webp
Paul Baran,Paul Baran was a Polish-American engineer who was a pioneer in the development of computer,"Paul Baran (1926-2011) was a Polish-born American engineer and pioneer in the field of computer networking. He is credited with the development of packet switching, a fundamental concept behind modern computer networks. Baran's work laid the foundation for the creation of the Internet as we know it today.","Paul Baran was a Polish-American engineer who was a pioneer in the development of computer networks. He was one of the two independent inventors of packet switching, which is today the dominant basis for data communications in computer networks worldwide, and went on to start several companies and develop other technologies that are an essential part of modern digital communication.","One of two independent inventors of the concept of digital packet switching used in modern computer networking including the Internet. Published a series of briefings and papers about dividing information into ""message blocks"" and sending them over distributed networks (1960–1964).",1926,2011,Hrodna,Belarus,Poland,20,1960,Cold War Computing,"[""networking"", ""communication""]",male,"[{""degree"": ""master's degree"", ""field"": null, ""institution"": ""University of California, Los Angeles"", ""year"": 1959}, {""degree"": ""licentiate"", ""field"": null, ""institution"": ""Drexel University"", ""year"": 1949}]","[{""name"": ""Edwin Howard Armstrong Achievement Award"", ""year"": 1987}, {""name"": ""IEEE Internet Award"", ""year"": 2000}, {""name"": ""EFF Award"", ""year"": 1993}, {""name"": ""Computer History Museum Fellow"", ""year"": null}, {""name"": ""SIGCOMM Award"", ""year"": 1989}, {""name"": ""IEEE Alexander Graham Bell Medal"", ""year"": 1990}, {""name"": ""Internet Hall of Fame"", ""year"": 2012}, {""name"": ""National Inventors Hall of Fame"", ""year"": 2007}, {""name"": ""National Medal of Technology and Innovation"", ""year"": 2007}, {""name"": ""Marconi Prize"", ""year"": 1991}, {""name"": ""Bower Award and Prize for Achievement in Science"", ""year"": 2001}, {""name"": ""Fellow of the American Academy of Arts and Sciences"", ""year"": 2003}]","[{""name"": ""RAND Corporation"", ""role"": null, ""years"": ""1959–1970""}]","[{""title"": ""On Distributed communications: I.introduction to distributed communications networks"", ""type"": ""other"", ""year"": 1964}, {""title"": ""packet switching"", ""type"": ""other"", ""year"": null}]",[],[],"[""Paul Baran (born Pesach Baran ; April 29, 1926 – March 26, 2011) was a Polish-American engineer who was a pioneer in the development of computer networks.""]",53.6683,23.8223,https://pioneersincs.blob.core.windows.net/pioneers-images/paul_baran.webp
