name,knownFor,intro,longBio,achievement,birthYear,deathYear,birthCity,birthCountry,nationality,century,contributionYear,era,classification,gender,education,awards,institutions,notableWorks,influencedBy,influenced,funFacts,latitude,longitude,imageLocal
Ken Thompson,Kenneth Lane Thompson is an American pioneer of computer science,"Ken Thompson (born 1943) is an American computer scientist and co-creator of the Unix operating system and the C programming language. He played a key role in the development of the original Unix system, including the creation of important tools and utilities. Thompson's work has had a lasting impact on the field of operating systems and software development.","Kenneth Lane Thompson is an American pioneer of computer science. Thompson worked at Bell Labs for most of his career where he designed and implemented the original Unix operating system. He also invented the B programming language, the direct predecessor to the C language, and was one of the creators and early developers of the Plan 9 operating system. Other notable contributions included his work on regular expressions and early computer text editors QED and ed, the definition of the UTF-8 encoding, and his work on computer chess that included the creation of endgame tablebases and the chess machine Belle.","Created the Unix operating system, the B programming language, Plan 9 operating system, the first machine to achieve a Master rating in chess, and the UTF-8 encoding at Bell Labs and the Go programming language at Google.",1943,,New Orleans,U.S.A,United States,20,1967,Cold War Computing,"[""operating systems"", ""programming languages""]",male,"[{""degree"": ""Master of Science"", ""field"": null, ""institution"": ""University of California, Berkeley"", ""year"": 1966}, {""degree"": ""Bachelor of Science"", ""field"": null, ""institution"": ""University of California, Berkeley"", ""year"": 1965}]","[{""name"": ""ACM Fellow"", ""year"": 2020}, {""name"": ""National Inventors Hall of Fame"", ""year"": 2019}, {""name"": ""ACM Software System Award"", ""year"": 1983}, {""name"": ""Japan Prize"", ""year"": 2011}, {""name"": ""Turing Award"", ""year"": 1983}, {""name"": ""National Medal of Technology and Innovation"", ""year"": 1998}, {""name"": ""IEEE Emanuel R. Piore Award"", ""year"": 1982}, {""name"": ""Harold Pender Award"", ""year"": 2003}, {""name"": ""Computer Pioneer Award"", ""year"": 1994}, {""name"": ""Computer History Museum Fellow"", ""year"": 1997}, {""name"": ""Tsutomu Kanai Award"", ""year"": 1999}, {""name"": ""IEEE Richard W. Hamming Medal"", ""year"": 1990}]","[{""name"": ""Bell Labs"", ""role"": null, ""years"": ""1966–2000""}, {""name"": ""Google"", ""role"": null, ""years"": ""2006–""}]","[{""title"": ""Plan 9"", ""type"": ""other"", ""year"": 1992}, {""title"": ""Belle"", ""type"": ""other"", ""year"": null}, {""title"": ""Go"", ""type"": ""other"", ""year"": null}, {""title"": ""ed"", ""type"": ""other"", ""year"": null}, {""title"": ""dbm"", ""type"": ""other"", ""year"": null}]",[],[],"[""Kenneth Lane Thompson (born February 4, 1943) is an American pioneer of computer science."", ""He also invented the B programming language, the direct predecessor to the C language, and was one of the creators and early developers of the Plan 9 operating system."", ""In 1983, he won the Turing Award with his long-term colleague Dennis Ritchie.""]",29.9513,-90.0713,https://pioneersincs.blob.core.windows.net/pioneers-images/ken_thompson.webp
Dennis Ritchie,Dennis MacAlistair Ritchie was an American computer scientist,"Dennis Ritchie (1941-2011) was an American computer scientist and co-creator of the Unix operating system and the C programming language. His contributions to the development of Unix and C have had a profound impact on modern operating systems and software development, shaping the foundations of the digital world we live in today.","Dennis MacAlistair Ritchie was an American computer scientist. He created, together with long-time colleague Ken Thompson, the Unix operating system, C programming language, and B programming language.","Known for creating the C programming language and co-developing the Unix operating system. His work laid the foundation for modern software development and had a profound impact on the field of computer science, earning him the Turing Award in 1983.",1941,2011,Bronxville,U.S.A,United States,20,1967,Cold War Computing,"[""operating systems"", ""programming languages""]",male,"[{""degree"": ""Master of Science"", ""field"": null, ""institution"": ""Harvard University"", ""year"": null}, {""degree"": ""Doctor of Philosophy"", ""field"": null, ""institution"": ""Harvard University"", ""year"": null}, {""degree"": null, ""field"": null, ""institution"": ""Summit High School"", ""year"": null}]","[{""name"": ""IEEE Emanuel R. Piore Award"", ""year"": 1982}, {""name"": ""Turing Award"", ""year"": 1983}, {""name"": ""Japan Prize"", ""year"": 2011}, {""name"": ""IEEE Richard W. Hamming Medal"", ""year"": 1990}, {""name"": ""Computer History Museum Fellow"", ""year"": 1997}, {""name"": ""National Medal of Technology and Innovation"", ""year"": 1998}, {""name"": ""ACM Software System Award"", ""year"": 1983}, {""name"": ""National Inventors Hall of Fame"", ""year"": 2019}, {""name"": ""Harold Pender Award"", ""year"": 2003}, {""name"": ""Computer Pioneer Award"", ""year"": 1994}, {""name"": ""IRI Achievement Award"", ""year"": 2006}]","[{""name"": ""Bell Labs"", ""role"": null, ""years"": ""1967–2007""}]","[{""title"": ""Plan 9"", ""type"": ""other"", ""year"": 1992}, {""title"": ""ALTRAN"", ""type"": ""other"", ""year"": null}, {""title"": ""The C Programming Language"", ""type"": ""other"", ""year"": 1978}, {""title"": ""BCPL"", ""type"": ""other"", ""year"": null}, {""title"": ""B"", ""type"": ""other"", ""year"": null}]",[],"[""Roberto Ierusalimschy""]",[],40.9383,-73.8323,https://pioneersincs.blob.core.windows.net/pioneers-images/dennis_ritchie.webp
Edwin Catmull,Edwin Earl Catmull is an American computer scientist and animator who is the co-founder of,Edwin Catmull (born 1945) is an American computer scientist and co-founder of Pixar Animation Studios. He is known for his contributions to computer graphics and computer animation. Catmull's work in developing algorithms and techniques for rendering and modeling has revolutionized the field of computer animation and has earned him numerous accolades and awards.,"Edwin Earl Catmull is an American computer scientist and animator who is the co-founder of Pixar and was the president of Walt Disney Animation Studios. He has been recognized for his contributions to 3D computer graphics, including the 2019 ACM Turing Award.","Computer generated imagery (CGI) and 3D graphics pioneer who developed texture mapping, the Catmull-Clark subdivision surface algorithm (with Jim Clark), and the Catmull-Rom spline (with Raphael Rom. Former vice president of Industrial Light & Magic and co-founder of and former president of Pixar",1945,,Parkersburg,U.S.A,United States,20,1974,Personal Computing Revolution,"[""computer graphics""]",male,"[{""degree"": null, ""field"": null, ""institution"": ""Granite High School"", ""year"": null}, {""degree"": null, ""field"": null, ""institution"": ""University of Utah"", ""year"": null}]","[{""name"": ""Producers Guild of America Awards"", ""year"": null}, {""name"": ""ACM Fellow"", ""year"": 1995}, {""name"": ""Progress Medal (SMPTE)"", ""year"": null}, {""name"": ""Academy Award of Merit"", ""year"": null}, {""name"": ""IEEE John von Neumann Medal"", ""year"": 2006}, {""name"": ""Turing Award"", ""year"": 2019}, {""name"": ""Computer History Museum Fellow"", ""year"": null}, {""name"": ""Gordon E. Sawyer Award"", ""year"": null}]","[{""name"": ""Industrial Light & Magic"", ""role"": null, ""years"": null}, {""name"": ""Q1047410"", ""role"": null, ""years"": null}, {""name"": ""Applicon"", ""role"": null, ""years"": null}, {""name"": ""Pixar"", ""role"": null, ""years"": null}, {""name"": ""New York Institute of Technology"", ""role"": null, ""years"": null}]",[],[],[],[],39.2663,-81.5615,https://pioneersincs.blob.core.windows.net/pioneers-images/edwin_catmull.webp
Per Brinch Hansen,"Per Brinch Hansen was a Danish-American computer scientist known for his work in operating systems,","Per Brinch Hansen (1938-2007) was a Danish computer scientist and software engineer. He made significant contributions to concurrent programming and operating systems. Hansen developed the monitor concept, which is widely used in concurrent programming languages. His work influenced the design of operating systems and played a key role in the advancement of parallel computing.","Per Brinch Hansen was a Danish-American computer scientist known for his work in operating systems, concurrent programming and parallel and distributed computing.","Developed the RC 4000 multiprogramming system, which introduced the concept of an operating system kernel and the separation of policy and mechanism; effectively the first microkernel architecture.Co-developed the monitor with Tony Hoare, and created the first monitor implementation. Implemented the first form of remote procedure call in the RC 4000,and was first to propose remote procedure calls as a structuring concept for distributed computing.",1938,2007,Frederiksberg,Denmark,Kingdom of Denmark,20,1969,Cold War Computing,"[""programming languages"", ""operating systems"", ""software engineering""]",male,"[{""degree"": null, ""field"": null, ""institution"": ""Technical University of Denmark"", ""year"": null}, {""degree"": null, ""field"": null, ""institution"": ""Skt. Jørgens Gymnasium"", ""year"": null}]","[{""name"": ""IEEE Fellow"", ""year"": null}, {""name"": ""Computer Pioneer Award"", ""year"": 2002}]","[{""name"": ""University of Copenhagen"", ""role"": null, ""years"": ""1984–1987""}, {""name"": ""Carnegie Mellon University"", ""role"": null, ""years"": ""1970–1972""}, {""name"": ""Regnecentralen"", ""role"": null, ""years"": ""1963–1970""}, {""name"": ""California Institute of Technology"", ""role"": null, ""years"": ""1972–1976""}, {""name"": ""University of Southern California"", ""role"": null, ""years"": ""1976–1984""}, {""name"": ""Syracuse University"", ""role"": null, ""years"": ""1987–2007""}]",[],[],[],[],55.6771,12.51343,https://pioneersincs.blob.core.windows.net/pioneers-images/per_brinch_hansen.webp
Elizabeth Feinler,"Elizabeth Jocelyn ""Jake""  Feinler is an American information scientist","Elizabeth Feinler is an American computer scientist and pioneer in the field of internet technology. She played a key role in the development of the ARPANET, the precursor to the internet, and was instrumental in establishing the first internet address registry. Feinler's work has had a lasting impact on the growth and organization of the internet.","Elizabeth Jocelyn ""Jake""  Feinler is an American information scientist. From 1972 until 1989 she was director of the Network Information Systems Center at the Stanford Research Institute. Her group operated the Network Information Center (NIC) for the ARPANET as it evolved into the Defense Data Network (DDN) and the Internet. While at NIC, her and her team created the Host Naming Registry (WHOIS) and the top-level domain naming convention that the internet still uses today. Before her inventions the internet would have not been able to scale and grow as much as it has today. Without her contributions users would have constantly use their IP address to get to their desired website, with the top-level naming convention it has made the navigation much more user friendly and convenient. The impact that her contribution has made is to make the internet much more usable for the average person and much easier for the internet to be managed as each domain there was a person who was attached to it, which is what the Host Naming Registry was for. Her contributions to the internet are still being used despite her retirement and is now managed by ICANN.","Lead team that defined a simple text file format for Internet host names, which became the Domain Name System; her group became the naming authority for the top-level domains of .mil, .gov, .edu, .org, and .com",1931,,Wheeling,U.S.A,United States,20,1974,Personal Computing Revolution,"[""internet""]",female,"[{""degree"": null, ""field"": null, ""institution"": ""Purdue University"", ""year"": null}]","[{""name"": ""Jonathan B. Postel Service Award"", ""year"": 2013}, {""name"": ""Women in Technology Hall of Fame"", ""year"": 2018}, {""name"": ""Internet Hall of Fame"", ""year"": 2012}]","[{""name"": ""SRI International"", ""role"": null, ""years"": null}]",[],"[""Douglas Engelbart""]",[],[],40.064,-80.7203,https://pioneersincs.blob.core.windows.net/pioneers-images/elizabeth_feinler.webp
Frances E. Allen,Frances Elizabeth Allen was an American computer scientist and pioneer in the field of optimizing,Frances E. Allen (1932-2020) was an American computer scientist and pioneer in the field of compiler optimization. She became the first woman to receive the Turing Award for her fundamental contributions to the theory and practice of optimizing compiler techniques. Allen's work significantly advanced the field of programming languages and compiler design.,"Frances Elizabeth Allen was an American computer scientist and pioneer in the field of optimizing compilers. Allen was the first woman to become an IBM Fellow, and in 2006 became the first woman to win the Turing Award. Her achievements include seminal work in compilers, program optimization, and parallelization. She worked for IBM from 1957 to 2002 and subsequently was a Fellow Emerita.","American computer scientist and pioneer in the field of compiler optimization. She was the first woman to receive the Turing Award in 2006 for her groundbreaking contributions to the theory and practice of optimizing compiler techniques. Allen's work significantly improved the performance of computer programs by developing advanced optimization algorithms and methodologies. Her research laid the foundation for modern compiler design and had a profound impact on the field of computer science. Allen was also an advocate for diversity and inclusion in computing, actively promoting the participation of women in the field.",1932,2020,Peru,U.S.A,United States,20,1970,Personal Computing Revolution,"[""programming languages""]",female,"[{""degree"": ""Master of Science"", ""field"": null, ""institution"": ""University of Michigan"", ""year"": 1957}, {""degree"": ""Bachelor of Science"", ""field"": null, ""institution"": ""State University of New York at Albany"", ""year"": 1954}]","[{""name"": ""Charles Babbage Award"", ""year"": 1997}, {""name"": ""Anita Borg Institute Women of Vision Awards"", ""year"": 2004}, {""name"": ""ACM Fellow"", ""year"": 1994}, {""name"": ""Ada Lovelace Award"", ""year"": 2002}, {""name"": ""Computer History Museum Fellow"", ""year"": 2000}, {""name"": ""Programming Languages Achievement Award"", ""year"": 1998}, {""name"": ""Turing Award"", ""year"": 2006}, {""name"": ""Computer Pioneer Award"", ""year"": 2004}, {""name"": ""Karen Spärck Jones Lecture"", ""year"": null}, {""name"": ""honorary doctorate from the University of Alberta"", ""year"": 1991}, {""name"": ""Women in Technology Hall of Fame"", ""year"": 1997}, {""name"": ""IEEE Fellow"", ""year"": null}, {""name"": ""IBM Fellow"", ""year"": 1989}, {""name"": ""Erna Hamburger Prize"", ""year"": 2008}, {""name"": ""Fellow of the American Academy of Arts and Sciences"", ""year"": null}]","[{""name"": ""IBM"", ""role"": null, ""years"": ""1957–""}, {""name"": ""University of California, Berkeley"", ""role"": null, ""years"": null}, {""name"": ""New York University"", ""role"": null, ""years"": null}, {""name"": ""University of California, San Diego"", ""role"": null, ""years"": null}]",[],[],[],[],44.5783,-73.5268,https://pioneersincs.blob.core.windows.net/pioneers-images/frances_e_allen.webp
Whitfield Diffie,Bailey Whitfield 'Whit' Diffie ForMemRS is an American cryptographer and mathematician and one of the,"Whitfield Diffie (born 1944) is an American cryptographer and one of the pioneers of public-key cryptography. He, along with Martin Hellman, introduced the concept of asymmetric encryption, which revolutionized secure communication over the internet. Diffie's work laid the foundation for modern cryptographic protocols and played a crucial role in ensuring digital privacy and security.","Bailey Whitfield 'Whit' Diffie ForMemRS is an American cryptographer and mathematician and one of the pioneers of public-key cryptography along with Martin Hellman and Ralph Merkle. Diffie and Hellman's 1976 paper New Directions in Cryptography introduced a radically new method of distributing cryptographic keys, that helped solve key distribution—a fundamental problem in cryptography. Their technique became known as Diffie–Hellman key exchange. The article stimulated the almost immediate public development of a new class of encryption algorithms, the asymmetric key algorithms.","Fundamental contributions to modern cryptography. Diffie and Hellman's groundbreaking 1976 paper ""New Directions in Cryptography introduced the ideas of public-key cryptography and digital signatures, the foundation of security protocols used on the Internet today.",1944,,New York City,U.S.A,United States,20,1976,Personal Computing Revolution,"[""cryptography"", ""network security""]",male,"[{""degree"": null, ""field"": null, ""institution"": ""Stanford University"", ""year"": null}, {""degree"": ""Bachelor of Science"", ""field"": null, ""institution"": ""Massachusetts Institute of Technology"", ""year"": 1965}, {""degree"": null, ""field"": null, ""institution"": ""Jamaica High School"", ""year"": null}]","[{""name"": ""Paris Kanellakis Award"", ""year"": 1996}, {""name"": ""National Cyber Security Hall of Fame"", ""year"": 2012}, {""name"": ""National Inventors Hall of Fame"", ""year"": 2011}, {""name"": ""Order of the Cross of Terra Mariana, 3rd Class"", ""year"": null}, {""name"": ""ACM Fellow"", ""year"": 2020}, {""name"": ""IEEE Koji Kobayashi Computers and Communications Award"", ""year"": 1999}, {""name"": ""IACR Fellow"", ""year"": 2004}, {""name"": ""honorary doctor of ETH Zürich"", ""year"": 1992}, {""name"": ""IEEE Richard W. Hamming Medal"", ""year"": 2010}, {""name"": ""Foreign Member of the Royal Society"", ""year"": 2017}, {""name"": ""Turing Award"", ""year"": 2015}, {""name"": ""Marconi Prize"", ""year"": 2000}, {""name"": ""Louis E. Levy Medal of the Franklin Institute"", ""year"": 1997}, {""name"": ""Computer History Museum Fellow"", ""year"": 2011}]","[{""name"": ""University of London"", ""role"": null, ""years"": null}]","[{""title"": ""Diffie–Hellman key exchange"", ""type"": ""other"", ""year"": null}]",[],[],"[""The article stimulated the almost immediate public development of a new class of encryption algorithms, the asymmetric key algorithms."", ""After his career at Sun Microsystems, where he became a Sun Fellow, Diffie served for two and a half years as Vice President for Information Security and Cryptography at the Internet Corporation for Assigned Names and Numbers (2010–2012)."", ""He has also served as a visiting scholar (2009–2010) and affiliate (2010–2012) at the Freeman Spogli Institute's Center for International Security and Cooperation at Stanford University, where he is currently a consulting scholar.""]",38.9073,-77.0363,https://pioneersincs.blob.core.windows.net/pioneers-images/whitfield_diffie.webp
Gary Kildall,Gary Arlen Kildall was an American computer scientist and microcomputer entrepreneur,"Gary Kildall (1942-1994) was an American computer scientist and entrepreneur. He developed the CP/M operating system, which became one of the most popular operating systems for early microcomputers. Kildall's work laid the foundation for modern operating systems, and he played a key role in the early development of the personal computer industry.","Gary Arlen Kildall was an American computer scientist and microcomputer entrepreneur. During the 1970s, Kildall created the operating system CP/M among other operating systems and programming tools, and subsequently founded Digital Research, Inc. to market and sell his software products. He is considered a pioneer of the personal computer revolution.","Introduced the theory of data-flow analysis in optimizing compilers (global expression optimization, Kildall's method). Worked on instruction set emulators (INTERP), found an innovative software relocation method (page boundary relocation), and laid the foundation to the concepts of binary recompilation (XLT86). Developed the first high-level programming language and compiler for microcomputers (PL/M) and the first mainstream operating system for microcomputers (CP/M). Invented the concept of a hardware abstraction layer called the BIOS, with both conceptually laying the foundation to all DOS-based operating systems on personal computers. Worked on diskette track buffering schemes, read-ahead algorithms, virtual disk drives, and file system caching. Developed the first computer interface for video disks and pioneered CD-ROM file systems, introducing the first encyclopedia for computers (The Electronic Encyclopedia). Pioneered a modular PBX communication system integrating land-lines with mobile phones (Intelliphone) and to remotely connect with home appliances.",1942,1994,Seattle,U.S.A,United States,20,1972,Personal Computing Revolution,"[""operating systems""]",male,"[{""degree"": null, ""field"": null, ""institution"": ""Queen Anne High School"", ""year"": null}, {""degree"": null, ""field"": null, ""institution"": ""University of Washington"", ""year"": null}]",[],"[{""name"": ""Naval Postgraduate School"", ""role"": null, ""years"": null}]","[{""title"": ""CP/M"", ""type"": ""other"", ""year"": null}]",[],[],"[""He is considered a pioneer of the personal computer revolution."", ""In 1974 in Pacific Grove, California, Kildall demonstrated the first working prototype of CP/M, which would later become the dominant operating system for microcomputers for a time.""]",47.6063,-122.3322,https://pioneersincs.blob.core.windows.net/pioneers-images/gary_kildall.webp
Michael O. Rabin,"Michael Oser Rabin was a computer scientist who was co-recipient, with Dana Scott, of the","Michael O. Rabin (born 1931) is an Israeli computer scientist and mathematician. He made significant contributions to theoretical computer science, particularly in the fields of algorithms, automata theory, and cryptography. Rabin co-developed the famous Miller-Rabin primality test and received the Turing Award for his influential work in the field of computer science.","Michael Oser Rabin was a computer scientist who was co-recipient, with Dana Scott, of the 1976 ACM Turing Award for their work on computational complexity.","The joint paper ""Finite Automata and Their Decision Problems,""which introduced the idea of nondeterministic machines, which has proved to be an enormously valuable concept. Their (Scott & Rabin) classic paper has been a continuous source of inspiration for subsequent work in this field.",1931,2026,Wrocław,Germany,Israel,20,1976,Personal Computing Revolution,"[""cryptography"", ""algorithms""]",male,"[{""degree"": null, ""field"": null, ""institution"": ""Hebrew Reali School"", ""year"": 1948}, {""degree"": ""Master of Science"", ""field"": null, ""institution"": ""Hebrew University of Jerusalem"", ""year"": null}, {""degree"": ""Doctor of Philosophy"", ""field"": null, ""institution"": ""Princeton University"", ""year"": 1956}, {""degree"": ""Bachelor of Science"", ""field"": null, ""institution"": ""Hebrew University of Jerusalem"", ""year"": null}]","[{""name"": ""Charles Babbage Award"", ""year"": 2000}, {""name"": ""The EMET Prize for Art, Science and Culture"", ""year"": 2004}, {""name"": ""Israel Prize"", ""year"": 1995}, {""name"": ""Turing Award"", ""year"": 1976}, {""name"": ""Paris Kanellakis Award"", ""year"": 2003}, {""name"": ""Dan David Prize"", ""year"": 2010}, {""name"": ""Foreign Member of the Royal Society"", ""year"": 2007}, {""name"": ""IACR Fellow"", ""year"": 2009}, {""name"": ""Gödel Lecturer"", ""year"": 2004}, {""name"": ""Josiah Willard Gibbs Lectureship"", ""year"": 1985}, {""name"": ""Rothschild Prize"", ""year"": null}, {""name"": ""Harvey Prize"", ""year"": 1980}, {""name"": ""honorary doctorate from University of Bordeaux-I"", ""year"": 1995}, {""name"": ""honorary doctorate of the Weizmann Institute of Science"", ""year"": null}, {""name"": ""ACM Fellow"", ""year"": 2020}]","[{""name"": ""Hebrew University of Jerusalem"", ""role"": null, ""years"": null}, {""name"": ""California Institute of Technology"", ""role"": null, ""years"": null}, {""name"": ""Technion – Israel Institute of Technology"", ""role"": null, ""years"": null}, {""name"": ""Massachusetts Institute of Technology"", ""role"": null, ""years"": null}]",[],[],[],[],51.1073,17.0385,https://pioneersincs.blob.core.windows.net/pioneers-images/michael_o_rabin.webp
